url,keywords
"https://www.youtube.com/watch?v=TDw_ku58CvQ","goml ssbm evenmatchupgaming ten video month melee tournaments finals httpswwwyoutubecomsu smash combo highlight ssbmmelee plays mo fighting best reel may combos grsmash grand bros super clips emg subscribe ft compiled youtube top ssbb footage"
"http://i.imgur.com/eCOAbOk.png",""
"https://www.reddit.com/r/boston","front reddit -- internet vote submit redditcom read page please ma sidebar boston comment"
"https://www.youtube.com/watch?v=nBfifW22iSI","roxbury video synthesizer college boston documentary south boston's synthesizers elsewhere- s experimental analog news end emerson railroad couple orange various line made synth clips st youtube subway using elevated scenes"
"https://www.google.com/","special images search webpages exactly including many information features find google looking help videos world's"
"https://accounts.google.com/SignOutOptions?hl=en&continue=https://www.google.com/","sign accounts google"
"https://myaccount.google.com/?utm_source=OGB",""
"https://myaccount.google.com/?utm_source=OGB&pli=1",""
"https://myaccount.google.com/privacy?utm_source=OGB&pli=1#personalinfo",""
"https://www.youtube.com/watch?v=pAt_nnE-9Ps","mulder parks xfiles amazing wow bag exp finds makes man's things worker detective piece adding average department later evidence devil jersey quite youtube discovery new"
"https://www.reddit.com/r/boston/?count=25&after=t3_4nendk","front reddit -- internet vote submit redditcom read page please ma sidebar boston comment"
"http://www.boston.com/jobs/jobs-news/2016/06/09/data-map-boston-workers-commute","mesmerizing workers commute boston's map morning shows every data"
"https://www.reddit.com/r/boston/?count=50&after=t3_4ndoqv","front reddit -- internet vote submit redditcom read page please ma sidebar boston comment"
"https://www.reddit.com/r/heroesofthestorm","front reddit internet vote submit redditcom heroes page comment storm"
"https://nextdoor.com/","neighborhood free social network join community private nextdoor"
"https://nextdoor.com/login/","neighborhood free social network community sign private nextdoor"
"https://www.reddit.com/r/haskell/","front reddit internet vote submit redditcom page haskell comment"
"https://en.wikipedia.org/wiki/System_F","free encyclopedia f wikipedia system"
"https://en.wikipedia.org/wiki/Typed_lambda_calculus","encyclopedia wikipedia free lambda calculus typed"
"https://www.reddit.com/r/haskell/comments/4naxe1/in_a_math_meaning_are_haskell_concepts_closer_to/","better reddit learn time field vote meaning submit discrete calculus redditcom gonna haskell closer algebra comment get help math concepts"
"https://en.wikipedia.org/wiki/Functor","encyclopedia functor wikipedia free"
"https://learnxinyminutes.com/","y programming minutes learn language x tours scenic"
"http://paulspontifications.blogspot.com/2013/01/when-haskell-is-faster-than-c.html","faster haskell c paul's pontifications"
"http://www.oberlin.edu/~math/faculty/bosch/magic.ps",""
"http://ieeexplore.ieee.org/xpls/abs_all.jsp?arnumber=5286501","selection search abstract gathering carlo monte applied ieee card xplore magic"
"http://ieeexplore.ieee.org/xpls/abs_all.jsp?arnumber=5286501&tag=1","selection search abstract gathering carlo monte applied ieee card xplore magic"
"https://www.revlo.co/khaldor","revlo"
"https://www.revlo.co/khaldor/giveaways/54950","revlo"
"https://i.reddituploads.com/b7a7756fae744fa9a567ecff8f4c8a2d?fit=max&h=1536&w=1536&s=a4fdc550497c670947a039fd2978b350",""
"https://www.twitch.tv/directory/all","talk leagues on-demand conventions video publishers month pro spanning events organizations press backbone world's gamers community entire tournaments chat esports twitch developers conferences twitch's platform industry distribution broadcast outlets ecosystem gather live also charity million shows every media includes players caters httpstwitchtv learn watch casual game leading top gaming"
"https://www.google.com/webhp?sourceid=chrome-instant&ion=1&espv=2&ie=UTF-8#q=python%20split/url?sa=t&rct=j&q=&esrc=s&source=web&cd=1&ved=0ahUKEwij0aaDx8vNAhXFGD4KHUgkDngQFggcMAA&url=http%3A%2F%2Fwww.tutorialspoint.com%2Fpython%2Fstring_split.htm&usg=AFQjCNFhK_exADKju1t2S-E34CFB9Bk5aA&sig2=pU2gLwrmoR4Elaek7L5u7A&bvm=bv.125596728,d.cWw","special images search webpages exactly including many information features find google looking help videos world's"
"https://it.tufts.edu/soft","tufts software technology services"
"http://tufts.onthehub.com",""
"http://scidb-py.readthedocs.io/en/stable/comparison_and_filtering.html","filtering scidb-py arrays comparing documentation"
"https://tufts.onthehub.com/WebStore/ProductSearchOfferingList.aspx?srch=stata","search results tufts discounts academic software university"
"https://e5.onthehub.com/WebStore/ProductSearchOfferingList.aspx?srch=stata&ws=78f779d1-76aa-dc11-ad27-0030485a6b08&vsro=8","search results tufts discounts academic software university"
"http://www.paradigm4.com/try_scidb/","management python database try data-obsessed programmable r scidb organizations system computational"
"https://paradigm4.atlassian.net/wiki/display/ESD/SciDB+Documentation","confluence documentation scidb"
"https://github.com/Paradigm4/SciDB-Py","scidb-py python github scidb wrapper paradigmscidb-py queries"
"http://scidb-py.readthedocs.org/","scidb-py documentation"
"http://www.paradigm4.com/try_scidb/scidb-py/","scidb-py management python remain include lets paradigm integration scidbs capabilities expands pythons massive-scale power programmer analytical data"
"http://www.paradigm4.com/try_scidb/scidb-r/","management rs remain include lets paradigm integration scidbs capabilities expands r massive-scale power scidb-r programmer analytical data"
"https://msdn.microsoft.com/en-us/library/hh313125(v=sql.110).aspx","sql migrating mysqltosql mysql server db azure databases"
"https://msdn.microsoft.com/en-us/library/hh313137(v=sql.110).aspx","mysqltosql mysql converting databases"
"https://github.com/jakevdp/SciDB-py","scidb-py python github scidb wrapper paradigmscidb-py queries"
"http://scidb-py.readthedocs.io/en/stable/","scidb-py documentation"
"http://scidb-py.readthedocs.io/en/stable/tutorial.html","basic use documentation scidb-py"
"http://scidb-py.readthedocs.io/en/stable/conversion.html","scidb-py documentation scidbarrays downloading"
"http://scidb-py.readthedocs.io/en/stable/query.html","scidb-py interface documentation scidb query"
"http://scidb-py.readthedocs.io/en/stable/demos.html","documentation scidb-py topics demos"
"http://scidb-py.readthedocs.io/en/stable/api.html","api scidb-py documentation"
"http://scidb-py.readthedocs.io/en/stable/classes.html","api scidb-py reference documentation"
"http://scidb-py.readthedocs.io/en/stable/afl.html","documentation scidb-py reference afl operator"
"http://scidb-py.readthedocs.io/en/stable/robust.html","operators documentation afl scidb-py robust"
"http://scidb-py.readthedocs.io/en/stable/schema_utils.html","scidb-py documentation schema manipulation utilities"
"http://scidb-py.readthedocs.io/en/stable/connection.html","documentation scidb-py arrays scidb introduction"
"http://scidb-py.readthedocs.io/en/stable/connection.html#loading-the-scidbpy-package-and-connecting-to-scidb","documentation scidb-py arrays scidb introduction"
"http://scidb-py.readthedocs.io/en/stable/connection.html#authenticated-and-encrypted-connections","documentation scidb-py arrays scidb introduction"
"http://scidb-py.readthedocs.io/en/stable/creation.html","documentation scidb-py arrays creating"
"http://scidb-py.readthedocs.io/en/stable/access.html","array documentation scidb-py data accessing"
"http://scidb-py.readthedocs.io/en/stable/operations.html","scidb-py objects basic array documentation scidb math"
"https://paradigm4.atlassian.net/wiki/display/ESD/SciDB+Data+Types+and+Casting","types confluence documentation scidb casting data"
"https://paradigm4.atlassian.net/wiki/display/ESD/SciDB+Database+Arrays","documentation confluence arrays scidb database"
"http://www.paradigm4.com/HTMLmanual/14.8/scidb_ug/ch07.html","arrays scidb chaptercreating removing"
"https://paradigm4.atlassian.net/wiki/display/ESD/load","confluence load documentation scidb"
"https://paradigm4.atlassian.net/wiki/display/ESD/SciDB+Operators","operators documentation scidb confluence"
"http://stackoverflow.com/questions/11799160/postgresql-field-type-for-unix-timestamp","stack overflow type field timestamp postgresql unix"
"http://www.postgresql.org/docs/9.1/static/datatype-datetime.html","datetime documentation postgresql types"
"http://www.w3schools.com/sql/sql_create_table.asp","sql statement table create"
"http://www.w3schools.com/sql/sql_insert.asp","sql insert statement"
"http://www.maangchi.com/tag/ddeokbokki","cooking korean ddeokbokki maangchi food maangchicom recipes"
"http://www.maangchi.com/photo/tteokbokki-made-by-wahida","photo dinner korean food maangchicom tteokbokki"
"https://dataclips.heroku.com/clips","account log page secure login heroku"
"https://docs.python.org/3/tutorial/datastructures.html","documentation structures python data"
"https://docs.python.org/2/library/functions.html","documentation functions python built-in"
"https://kat.cr/usearch/diablo%202%20lod/","fast kickass lod come free diablo absolutely download downloads torrents"
"https://kat.cr/usearch/diablo/","fast kickass come free absolutely diablo download downloads torrents"
"https://kat.cr/usearch/diablo/?field=seeders&sorder=desc","fast kickass come free absolutely diablo download downloads torrents"
"https://kat.cr/usearch/diablo%20category:games/","fast kickass games come free diablo absolutely download downloads torrents"
"https://wiki.archlinux.org/index.php/list_of_applications","archwiki applications list"
"https://www.youtube.com/","free music family youtube share upload video friends content enjoy world sharing camera videos original phone love"
"https://www.youtube.com/watch?v=uQ_DHRI-Xp0","west itunes apple httpsmarturlitthatparttidal schoolboy ft album interscope kanye youtube feat dropping tidal raphip-hop part q mu top now dawg httpsmarturlitthatpart"
"https://wiki.archlinux.org/index.php/CDemu","archwiki cdemu"
"https://www.youtube.com/watch?v=wokbmH1iGtU","casino hd redrose clams subscribe like music amazing youtube track video cell released p twitter pogo ryancelsiu unofficial casino's gorilla httpbitlyrgmwu"
"https://www.google.com/search?q=arch+install+diablo+2&oq=arch+install+diablo+2&aqs=chrome..69i57.3693j0j9&sourceid=chrome&ie=UTF-8","search diablo arch install google"
"http://us.battle.net/en/search?q=diablo+2+installation","search battlenet"
"https://www.facebook.com/","facebook account send log family share messages friends photos connect know get updates videos people sign create"
"http://boards.4chan.org/mu/","types chan's music chan mu imageboardworksafemusicmpcdradiobandipodmusic industry discussing imageboard"
"http://boards.4chan.org/mu/catalog","types chan's music chan mu imageboardworksafemusicmpcdradiobandipodmusic industry discussing imageboard catalog"
"https://postgres.heroku.com/databases/swpp-server-stage-database","account log page secure login heroku"
"https://dataclips.heroku.com","account log page secure login heroku"
"http://stackoverflow.com/questions/10379448/plotting-directed-graphs-in-python-in-a-way-that-show-all-edges-separately","graphs stack python overflow directed way edges separately show plotting"
"https://graph-tool.skewed.de/","graph python library module graph-tool efficent analysis network de peixoto metaprogramming tiagoskewedde paula efficient tiago"
"https://networkx.github.io/documentation/development/reference/classes.digraph.html","graphs digraph loops self documentation directed dev networkx"
"https://www.google.com/search?q=skepta&oq=skepta&aqs=chrome..69i57j0j69i61j0l3.583j0j7&sourceid=chrome&ie=UTF-8","search google skepta"
"http://stackoverflow.com/questions/7915998/does-uninstalling-a-package-with-pip-also-removes-the-dependent-packages","stack removes pip python overflow also package packages dependent uninstalling"
"https://github.com/invl/pip-autoremove","unused invlpip-autoremove github dependencies remove pip-autoremove package"
"https://networkx.github.io/documentation/networkx-1.10/reference/drawing.html","documentation drawing networkx"
"http://paradigm4.com/HTMLmanual/13.3/scidb_ug/ch05s06.html","special data values"
"https://www.google.com/webhp?sourceid=chrome-instant&ion=1&espv=2&ie=UTF-8#q=moldy%20dried%20anchovies/url?sa=t&rct=j&q=&esrc=s&source=web&cd=12&ved=0ahUKEwiE0c_-ibDNAhWC9x4KHXohBL8QFghJMAs&url=http%3A%2F%2Fwww.chowhound.com%2Fpost%2Fdark-fuzz-dried-anchovies-840478&usg=AFQjCNGnJhxZDgnCkyilAUGdEytHCVu8Qg&sig2=3SzVvBTdCb3bf5EsoBe9Fw&bvm=bv.124817099,d.dmo","special images search webpages exactly including many information features find google looking help videos world's"
"http://networkx.readthedocs.io/en/networkx-1.11/","documentation networkx"
"http://networkx.readthedocs.io/en/networkx-1.11/reference/index.html","documentation reference networkx"
"http://networkx.readthedocs.io/en/networkx-1.11/reference/drawing.html","documentation drawing networkx"
"http://stackoverflow.com/questions/19212979/draw-graph-in-networkx","graph overflow python stack draw networkx"
"http://stackoverflow.com/questions/22024650/why-networkx-draw-produces-nothing?lq=1","nothing stack python overflow produces networkxdraw"
"http://matplotlib.org/api/pyplot_api.html","documentation pyplot matplotlib"
"http://stackoverflow.com/questions/19212979/draw-graph-in-networkx?lq=1","graph overflow python stack draw networkx"
"http://networkx.readthedocs.io/en/networkx-1.11/reference/generated/networkx.drawing.nx_pylab.draw_networkx.html#networkx.drawing.nx_pylab.draw_networkx","documentation drawnetworkx networkx"
"https://processing.org/reference/width.html","width processing api language"
"https://processing.org/reference/","api reference processing language"
"https://processing.org/reference/PVector.html","api language processing pvector"
"http://www.cs.waikato.ac.nz/ml/weka/index.html","source weka machine mining learning software java open data"
"https://www.facebook.com/#","facebook account send log family share messages friends photos connect know get updates videos people sign create"
"https://dataclips.heroku.com/clipsavxsgosminchktyuqcbdqgjjkavj-Edges","account log page secure login heroku"
"https://www.netmarketshare.com/browser-market-share.aspx?qprid=2&qpcustomd=0","lists chrome firefox like internet use browser share safari opera report top explorer market browsers"
"https://www.netmarketshare.com/browser-market-share.aspx?qprid=2&qpcustomd=0report.aspx?qprid=3&qpaf=&qpcustom=Chrome+50.0&qpcustomb=0","lists chrome firefox like internet use browser share safari opera report top explorer market browsers"
"https://www.netmarketshare.com/browser-market-share.aspx?qprid=2&qpcustomd=0browser-market-share.aspx?qprid=0&qpcustomd=1","lists chrome firefox like internet use browser share safari opera report top explorer market browsers"
"https://www.netmarketshare.com/browser-market-share.aspx?qprid=0&qpcustomd=1","lists chrome firefox like internet use browser share safari opera report top explorer market browsers"
"https://www.netmarketshare.com/browser-market-share.aspx?qprid=0&qpcustomd=1browser-market-share.aspx?qprid=0&qpcustomd=0","lists chrome firefox like internet use browser share safari opera report top explorer market browsers"
"https://www.netmarketshare.com/browser-market-share.aspx?qprid=0&qpcustomd=0","lists chrome firefox like internet use browser share safari opera report top explorer market browsers"
"https://www.netmarketshare.com/browser-market-share.aspx?qprid=0&qpcustomd=0browser-market-share.aspx?qprid=0&qpcustomd=0&qptimeframe=Y","lists chrome firefox like internet use browser share safari opera report top explorer market browsers"
"https://www.netmarketshare.com/browser-market-share.aspx?qprid=0&qpcustomd=0&qptimeframe=Y","lists chrome firefox like internet use browser share safari opera report top explorer market browsers"
"https://www.netmarketshare.com/browser-market-share.aspx?qprid=0&qpcustomd=0&qptimeframe=Ybrowser-market-share.aspx?qprid=0&qpcustomd=0&qptimeframe=Q","lists chrome firefox like internet use browser share safari opera report top explorer market browsers"
"https://www.netmarketshare.com/browser-market-share.aspx?qprid=0&qpcustomd=0&qptimeframe=Q","lists chrome firefox like internet use browser share safari opera report top explorer market browsers"
"https://www.netmarketshare.com/browser-market-share.aspx?qprid=0&qpcustomd=0&qptimeframe=Qbrowser-market-share.aspx?qprid=0&qpcustomd=0&qptimeframe=W","lists chrome firefox like internet use browser share safari opera report top explorer market browsers"
"https://www.netmarketshare.com/browser-market-share.aspx?qprid=0&qpcustomd=0&qptimeframe=W","lists chrome firefox like internet use browser share safari opera report top explorer market browsers"
"https://www.netmarketshare.com/browser-market-share.aspx?qprid=0&qpcustomd=0&qptimeframe=Wbrowser-market-share.aspx?qprid=0&qpcustomd=0","lists chrome firefox like internet use browser share safari opera report top explorer market browsers"
"https://www.netmarketshare.com/browser-market-share.aspx?qprid=0&qpcustomd=0browser-market-share.aspx?qprid=1&qpcustomb=0","lists chrome firefox like internet use browser share safari opera report top explorer market browsers"
"https://www.google.com/search?q=seocho+chungdahm+learning&oq=seocho+chungdahm+learning&aqs=chrome..69i57&sourceid=chrome&ie=UTF-8","learning search chungdahm google seocho"
"https://maps.google.com/maps?q=seocho+chungdahm+learning&um=1&ie=UTF-8&sa=X&ved=0ahUKEwj1xKSszaXNAhXCWz4KHSY3Be4Q_AUICCgB","maps google"
"https://api.jquery.com/has-selector/","api jquery write library jqueryorg javascript foundation documentation less selector"
"https://www.facebook.com/?ref=logo","facebook account send log family share messages friends photos connect know get updates videos people sign create"
"https://dataclips.heroku.com/avxsgosminchktyuqcbdqgjjkavj-Edges","account log page secure login heroku"
"https://msdn.microsoft.com/en-us/library/ms537434(v=vs.85).aspx","internet explorer property"
"https://css-tricks.com/snippets/javascript/get-possible-dom-events/","running can eg firefox console onclick possible array isubstrin events css-tricks dom get filterfunctionireturn start"
"http://stackoverflow.com/questions/9368538/getting-an-array-of-all-dom-events-possible","getting stack overflow javascript possible array events dom"
"http://www.cs.waikato.ac.nz/ml/weka/documentation.html","source weka machine mining learning software java open data"
"http://weka.wikispaces.com/","home weka"
"http://stackoverflow.com/questions/8492344/javascript-attach-an-onclick-event-to-all-links","stack overflow onclick javascript event links attach"
"https://www.google.com/webhp?sourceid=chrome-instant&ion=1&espv=2&ie=UTF-8#q=target%20and%20currenttarget%20in%20javascript","special images search webpages exactly including many information features find google looking help videos world's"
"https://developer.mozilla.org/en-US/docs/Web/API/MouseEvent","apis represents common include mouseup mousedown dblclick interacting mouseevent occur user web device interface mouse using events click due pointing mdn"
"https://www.google.com/webhp?sourceid=chrome-instant&ion=1&espv=2&ie=UTF-8#q=javascript%20iterate%20over%20object","special images search webpages exactly including many information features find google looking help videos world's"
"http://stackoverflow.com/questions/684672/how-do-i-loop-through-or-enumerate-a-javascript-object/5737136#5737136","stack overflow enumerate object javascript loop"
"https://developer.mozilla.org/en-US/docs/Web/JavaScript/Reference/Global_Objects/Object/keys","objectkeys order method properties difference enumerable prototype chain javascript object's for-in loop array returns given well forin enumerates provided mdn"
"https://www.google.com/webhp?sourceid=chrome-instant&ion=1&espv=2&ie=UTF-8#q=flask%20cant%20locate%20revision%20identified","special images search webpages exactly including many information features find google looking help videos world's"
"http://stackoverflow.com/questions/32311366/alembic-util-command-error-cant-find-identifier","stack overflow command alembic error util find postgresql identifier"
"https://www.google.com/webhp?sourceid=chrome-instant&ion=1&espv=2&ie=UTF-8#q=psql%20create%20table","special images search webpages exactly including many information features find google looking help videos world's"
"https://www.reddit.com/r/heroesofthestorm/comments/4ni9dr/are_hots_matches_determined_more_by_the_best/","talk heroesofthestorm reddit vote redditcom charts heroes player one hots favorite people worst submit detailed best storm determined updated games analysis using topics team comment math much drag m matches"
"https://www.google.com/webhp?sourceid=chrome-instant&ion=1&espv=2&ie=UTF-8#q=remove%20rows%20in%20psql","special images search webpages exactly including many information features find google looking help videos world's"
"https://msdn.microsoft.com/en-us/library/ms537434(v=vs.85).aspx#","internet explorer property"
"http://stackoverflow.com/questions/27911685/how-can-i-programmatically-set-the-target-metadata-required-by-alembic-for-use?rq=1","api can 'targetmetadata' python stack command overflow use alembic required set programmatically"
"https://www.google.com/webhp?sourceid=chrome-instant&ion=1&espv=2&ie=UTF-8#q=psql%20insert","special images search webpages exactly including many information features find google looking help videos world's"
"https://www.reddit.com/r/smashbros/comments/4nwxa0/20xxte_ran_perfectly_at_smashnsplash_whats_next/","next reddit huge vote xxte submit ran smash'n'splash redditcom smashbros congrats comment httpstwittercomdansalvatostatus perfectly"
"https://www.google.com/webhp?sourceid=chrome-instant&ion=1&espv=2&ie=UTF-8#q=sealed+at+home+magic/url?sa=t&rct=j&q=&esrc=s&source=web&cd=1&ved=0ahUKEwihga3iirPNAhVEHh4KHRLiARkQFggcMAA&url=http%3A%2F%2Fmagic.wizards.com%2Fen%2Fgameinfo%2Fgameplay%2Fformats%2Fsealeddeck&usg=AFQjCNER0o85vulEpVrM9pMS6uyys-yjZw&sig2=1vKWFiu-tIgXV7yl7RJdfg&bvm=bv.124817099,d.dmo","special images search webpages exactly including many information features find google looking help videos world's"
"https://www.youtube.com/results?search_query=dan+salvato","free salvato music youtube share upload family video friends content dan enjoy world sharing camera videos original phone love"
"https://www.youtube.com/user/dansalvato1/videos","guy frankerfacez video dan thanks smash play ie story melon people stopping free also made sharing super yoshi's salvato youtube know speedrun camera upload phone"
"https://www.youtube.com/user/dansalvato1/videoshttps://www.youtube.com/user/dansalvato1/videosuser/dansalvato1/videos","guy frankerfacez video dan thanks smash play ie story melon people stopping free also made sharing super yoshi's salvato youtube know speedrun camera upload phone"
"https://www.youtube.com/user/dansalvato1","guy frankerfacez video dan thanks smash play ie story melon people stopping free also made sharing super yoshi's salvato youtube know speedrun camera upload phone"
"https://www.google.com/webhp?sourceid=chrome-instant&ion=1&espv=2&ie=UTF-8#q=flask+alembic+keyerror","special images search webpages exactly including many information features find google looking help videos world's"
"https://dashboard.heroku.com/apps/swpp-server-stage/resources","heroku"
"https://postgres.heroku.com/discover?hid=resource13816555@heroku.com","account log page secure login heroku"
"https://dataclips.heroku.com/clips/new?heroku_resource_id=resource13816555%40heroku.com&heroku_resource_name=DATABASE","account log page secure login heroku"
"https://www.google.com/webhp?sourceid=chrome-instant&ion=1&espv=2&ie=UTF-8#q=database%20on%20tufts","special images search webpages exactly including many information features find google looking help videos world's"
"https://www.eecs.tufts.edu/userguide/?","cs userguide ece systems login"
"https://www.eecs.tufts.edu/userguide/?./forms/database.php","cs userguide ece systems login"
"https://www.youtube.com/watch?v=aWb9b4UwtRA","creator fashion youtube live pm wang stream tyler show pst golf"
"https://www.youtube.com/watch?v=aWb9b4UwtRAhttps://www.youtube.com/watch?v=aWb9b4UwtRAwatch?v=aWb9b4UwtRA","youtube"
"https://postgres.heroku.com/databases/swpp-server-stage-database#snapshots","account log page secure login heroku"
"https://postgres.heroku.com/databases/swpp-server-stage-database#snapshots#snapshots","account log page secure login heroku"
"https://www.google.com/webhp?sourceid=chrome-instant&ion=1&espv=2&ie=UTF-8#q=git%20revert%20single%20file","special images search webpages exactly including many information features find google looking help videos world's"
"https://www.google.com/webhp?sourceid=chrome-instant&ion=1&espv=2&ie=UTF-8#q=flask%20alembic%20stamp","special images search webpages exactly including many information features find google looking help videos world's"
"https://www.facebook.com/##","facebook account send log family share messages friends photos connect know get updates videos people sign create"
"https://developer.mozilla.org/en-US/docs/Web/Accessibility","accessibility development accessible use way limited people's many abilities web possible information developing content means provide even people enabling sites mdn"
"https://developer.mozilla.org/en-US/docs/Web/Accessibility/Web_Development","accessibility development provides document web information developers xul mdn"
"https://dashboard.heroku.com/apps/swpp-server-stage","heroku"
"https://dataclips.heroku.com/avxsgosminchktyuqcbdqgjjkavj-Edges/avxsgosminchktyuqcbdqgjjkavj-Edges","account log page secure login heroku"
